{"$defs":{"expect-metric-error":{"additionalProperties":false,"properties":{"code":{"maximum":11,"minimum":0,"type":"integer"},"error":{"enum":["InvalidEncoding","UnsupportedVersion","UnsupportedAlgorithm","InvalidBinning","InconsistentLength","InvalidProbability","InvalidOutcome","InvalidIdentifier","DuplicatePrediction","NonCanonicalOrder","InvalidMinimum","ResourceLimit"]},"first_coordinate":{"pattern":"^(input|trailing|magic|version|algorithm_id|algorithm_major|binning|minimum_scored_records|record_count|records(/(0|[1-9][0-9]*)(/[0-5])?)?)$","type":"string"},"kind":{"const":"metric-error"}},"required":["kind","error","code","first_coordinate"],"type":"object"},"expect-resource-limit":{"additionalProperties":false,"properties":{"code_id":{"const":"resource-limit"},"kind":{"const":"resource-limit"}},"required":["kind","code_id"],"type":"object"},"expect-transport-rejection":{"additionalProperties":false,"properties":{"error":{"const":"FieldOutOfBounds"},"kind":{"const":"transport-rejection"}},"required":["kind","error"],"type":"object"},"hex32":{"pattern":"^[0-9a-f]{64}$","type":"string"},"member":{"additionalProperties":false,"properties":{"blake3":{"$ref":"#/$defs/hex32"},"bytes":{"maximum":67108864,"minimum":1,"type":"integer"},"record":{"enum":["MTI1","MTQ1","MTR1"]}},"required":["record","blake3","bytes"],"type":"object"},"stimulus-execution-steps":{"additionalProperties":false,"properties":{"kind":{"const":"execution-steps"},"maximum":{"$ref":"#/$defs/u64"},"requested":{"$ref":"#/$defs/u64"}},"required":["kind","maximum","requested"],"type":"object"},"stimulus-oversized-member":{"additionalProperties":false,"properties":{"bytes":{"$ref":"#/$defs/u64"},"ceiling_bytes":{"const":67108864},"fill":{"const":"zero"},"kind":{"const":"oversized-member"},"record":{"const":"MTI1"}},"required":["kind","record","bytes","ceiling_bytes","fill"],"type":"object"},"subcase":{"additionalProperties":false,"properties":{"expect":{"oneOf":[{"$ref":"#/$defs/expect-metric-error"},{"$ref":"#/$defs/expect-transport-rejection"},{"$ref":"#/$defs/expect-resource-limit"}]},"id":{"pattern":"^res\\.[0-9]+[a-z]?$","type":"string"},"member":{"oneOf":[{"$ref":"#/$defs/member"},{"type":"null"}]},"stimulus":{"oneOf":[{"$ref":"#/$defs/stimulus-oversized-member"},{"$ref":"#/$defs/stimulus-execution-steps"}]},"title":{"$ref":"#/$defs/text"}},"required":["id","title","member","expect"],"type":"object"},"text":{"pattern":"^[ -~]*$","type":"string"},"u64":{"maximum":9007199254740991,"minimum":0,"type":"integer"}},"$id":"urn:pigloros:metric-conformance:case:v2:resource-exhaustion","$schema":"https://json-schema.org/draft/2020-12/schema","additionalProperties":false,"properties":{"algorithm":{"additionalProperties":false,"properties":{"id":{"const":"pigloros.metric.binary-calibration"},"major":{"const":1}},"required":["id","major"],"type":"object"},"family":{"const":"resource-exhaustion"},"schema":{"const":"pigloros.metric-conformance.case.v2"},"subcases":{"items":{"$ref":"#/$defs/subcase"},"maxItems":64,"minItems":1,"type":"array"}},"required":["schema","family","algorithm","subcases"],"title":"Metric conformance case payload, family resource-exhaustion","type":"object"}
