{"algorithm":{"id":"pigloros.metric.binary-calibration","major":1},"family":"resource-exhaustion","schema":"pigloros.metric-conformance.case.v2","subcases":[{"expect":{"code":11,"error":"ResourceLimit","first_coordinate":"record_count","kind":"metric-error"},"id":"res.1","member":{"blake3":"5bd6c28983e3467c06d9c71f443e72e8005b4c9599bd5696fdf3c11ae87e2ac5","bytes":52,"record":"MTI1"},"title":"declared record_count 262145: ResourceLimit before any record is read"},{"expect":{"error":"FieldOutOfBounds","kind":"transport-rejection"},"id":"res.2","member":null,"stimulus":{"bytes":67108865,"ceiling_bytes":67108864,"fill":"zero","kind":"oversized-member","record":"MTI1"},"title":"an MTI1 member above the 64 MiB member ceiling is rejected by the transport (#222)"},{"expect":{"code_id":"resource-limit","kind":"resource-limit"},"id":"res.3","member":{"blake3":"3e0d37ad7973a5e0b44729889f9ed533d70ec9528de87b33dd06ff96bf9d18ce","bytes":128,"record":"MTI1"},"stimulus":{"kind":"execution-steps","maximum":10000000,"requested":10000001},"title":"execution-step budget exceeded"}]}
